{
  "schema": "sulde-observation-event-v1",
  "event_id": "0123456789abcdef0123456789abcdef",
  "occurred_at": "2026-08-14T02:00:00.000000Z",
  "domain": "execution",
  "type": "execution.self_repair",
  "phase": "finalized",
  "outcome": "success",
  "provider": "system",
  "actor": "agent-runtime",
  "correlation": {
    "task_id": "sha256:0123456789abcdef01234567"
  },
  "source": {
    "kind": "self-repair-execution",
    "name": "kb:self-repair/executed.jsonl",
    "line": 7,
    "row_sha256": "0123456789abcdef0123456789abcdef0123456789abcdef0123456789abcdef"
  },
  "attributes": {
    "check_count": 3,
    "passed_check_count": 3,
    "report_sha256": "abcdef0123456789abcdef0123456789abcdef0123456789abcdef0123456789"
  }
}
